기업명,주요업무,자격요건,우대사항
몰로코,"[ The Impact You’ll Be Contributing to Moloco ]• Define and execute the product strategy and roadmap for Moloco Ads products with a team of world-class engineers, data scientists, designers, GTM, sales and other functional owners.• Own the end-to-end product lifecycle from conceptualization to experimentation and launch, ensuring the products meet customer needs.• Establish and monitor key performance indicators (KPIs) to measure product success, refine the strategy and roadmap as necessary, and drive continuous improvements.• Lead cross-functional teams to drive rapid and high-quality product development.• Synthesize large amounts of internal and external data from multiple sources and glean analytical insights for product development.• Stay on top of industry trends, including competitors, and develop new product offerings and positioning ideas.• Collaborate with various internal and external partners to advance the product.• Troubleshoot day-to-day operational roadblocks.[ The Opportunity ]Moloco is seeking a passionate and self-starting product manager. As a Product Manager, you will help us define our vision, strategy, and roadmap to bring state-of-the-art advertising products to the market. You will analyze the mobile advertising landscape and collaborate with cross-functional teams to turn. Moloco’s industry-leading technical assets into game-changing products that will lead the market.","• In-depth ad-tech experience.• Proven work experience (10+ years) in Product Management.• Proven ability to understand customer needs, translate that into compelling products and services, and drive product growth.• Dealing with underlying complex technical requirements and ambiguity in a fast-paced work environment with changing priorities.• Hands-on experience working in an agile environment with a rapid iteration cadence (Launch new products and features, test their performance, and iterate quickly).• Track record of using data and quantitative research methodologies to inform decision-making across the entire product development lifecycle.• Strong analytical and problem-solving skills with the ability to think strategically and stay on top of tactical execution.• Ability to multitask and manage multiple projects at a time while paying attention to detail.• Fast learner and self-initiative personality.• Experience effectively working with multiple functional areas such as Engineering, Data Scientist, UX Design, Product Specialist, Finance, GTM or Sales.• Fluent in speaking and writing both Korean and English.","• Great communication skills.• Statistics, Economics, and Computer Science majors.• Experience in SQL or another data analytics language."
라이트뷰,"• LITEVIEW 시스템의 전반적인 사양 설계, 프로젝트 관리, 품질 관리■ 아래 중 하나 이상의 영역에서 활약해 주시기를 기대합니다.지원자의 경험과 지향에 따라 다음의 영역 중 하나 이상에서 활약하실 수 있습니다.① 사양 설계 및 프로덕트 기획 영역• 노코드/로우코드 툴에 대한 지식• 웹/앱 서비스의 화면 설계 및 기능 요구사항 정의 경험• 사용자 관점에 기반한 프로덕트 요구사항 도출 경험• 디자이너 및 엔지니어와의 협업을 통한 프로덕트 개발 경험② 프로젝트 매니지먼트 영역• B2B 또는 D2C 서비스에서의 진행 관리, 일정 관리, 리소스 배분 실무 경험• 고객 요구사항 분석, 스토리보드 작성, 사양 조정, 검수 대응 경험• 여러 부서 및 외부 이해관계자와의 조율 및 협상 경험• 스타트업 또는 신규 사업 론칭에서의 PM/PdM 경험• 프로젝트 우선순위 설정 및 로드맵 수립 경험③ 품질 관리 및 운영 설계 영역• 테스트 설계 및 QA 프로세스 구축 경험• 출시 후 트러블 대응 및 개선 플로우 설계·운영 경험• 데이터 분석에 기반한 개선 제안 및 기능 최적화 경험• 결함 재발 방지를 포함한 품질 안정화를 위한 운영 설계 경험.",• 일본어 회화 가능 (JLPT N1 또는 이와 동등한 수준의 회화 가능)• 일본대학 졸업 또는 일본 기업에서 3년이상 근무자.,
페이히어,"[프로덕트 매니저]는 이런 일을 해요• 사용자와 시장의 목소리를 기반으로 제품의 문제를 정의하고, 개선 방향을 설계합니다.• 스쿼드 단위로 제품 목표와 지표를 설정하고, 제품의 라이프사이클을 관리합니다.• 비즈니스, CX, 마케팅 등 다양한 직군과 협업해 서비스 완성도를 높입니다.• 제품 로드맵을 관리하며, 서비스의 방향과 우선순위를 결정합니다.","[이런 경험이 있으신 분을 찾고 있어요]• 3년 이상의 IT 서비스 프로덕트 매니저 경험이 있는 분을 찾습니다.• 문제를 구조적으로 정의하고, 실행을 통해 해결한 경험이 있는 분을 찾습니다.• 데이터와 고객·시장 인사이트를 근거로 판단하고 소통할 수 있는 분을 찾습니다.• 다양한 직군과 협업하며 공통의 목표를 이끌어본 경험이 있는 분을 찾습니다.• 제품의 성장을 비즈니스 임팩트로 연결해본 경험이 있는 분을 찾습니다.","[이런 경험이 있으시면 더 좋아요]• 결제 및 오프라인 결제 인프라(VAN, 카드사 등)에 대한 이해가 있는 분이면 더욱 좋습니다.-SQL, DB 설계, Python, Java 등 기술적 이해 또는 학습 경험이 있는 분이면 더욱 좋습니다.• 하드웨어 기반 서비스나 B2B SaaS 제품 경험이 있는 분이면 더욱 좋습니다.• 지표 기반 의사결정 및 제품 성과 관리 경험이 있는 분이면 더욱 좋습니다."
에스엠해썹,ㆍAI 서비스 프로젝트 기획 및 관리ㆍ프로젝트 실행 및 진척 관리ㆍ고객의 요구사항 분석 및 솔루션 제안ㆍ내/외부 협업 및 커뮤니케이션 리딩ㆍ프로젝트 산출물 관리.,"ㆍPM 및 소프트웨어 개발 경력 총 3년 이상ㆍIT 서비스 또는 AI 기반 솔루션 기획 및 프로젝트 관리(PM) 경력을 보유하신 분ㆍML/DL 모델 혹은 LLM, RAG, 벡터 DB 등 최신 AI 기술 및 개발 프로세스에 대한 이해도를 갖추신 분ㆍ고객사, 프로젝트 팀, 경영진 등 다양한 이해관계자와 명확하고 효과적으로 소통하고 협업을 이끌어낼 수있는 분ㆍ프로젝트 제안서 및 수행 계획 등 핵심 문서를 논리적으로 작성할 수 있는 분ㆍ목표 달성을 위해 주도적으로 프로젝트를 이끌고 책임감 있게 완수하는 분.","ㆍAI 관련 서비스 프로젝트 관리 경험이 있으신 분ㆍAI Tool(Figma, Cursor, Reddy 등) 사용 경험이 있으신 분ㆍML/DL 기반의 서비스 혹은 관련 사업 프로젝트에 참여한 경험이 있으신 분ㆍLangChain, LangGraph 등 LLM 프레임워크 기반 서비스 혹은 관련 사업 프로젝트에 참여한 경험이 있으신 분ㆍ제조/식품 산업 도메인 지식을 보유하신 분ㆍ정부 지원 사업 및 R&D 과제를 수행해 본 경험이 있으신 분ㆍ다수의 프로젝트를 동시에 관리하는 멀티태스킹 역량이 뛰어난 분."
스카이랩스(SkyLabs),"이런 업무를 하시게 됩니다.• 제품개발 프로젝트의 전체 일정 관리를 담당하며, 여러 팀 간 협업 조율• 프로덕트 로드맵을 기반으로 한 실행 전략 수립 및 목표 달성 관리• 내부 개발팀 간 커뮤니케이션 허브 역할을 수행• 기술적 리스크와 이슈 관리, 우선순위 조정, 문제 해결 프로세스 수립 및 개선• 프로젝트 문서화, 개발 표준 및 프로세스 개선, 운영 효율성 강화를 위한 제안 및 실행• 개발 조직 내 일정 관리·업무 분배·리소스 최적화를 통한 생산성을 극대화.","이런 분들을 모시려고 해요.• 총 경력 8~15년(HW/기구/FW 개발 경력 포함), 3년 이상 PM/PL 경험이 있으신 분• 프로젝트 관리 및 기술적 배경(TPM, PM, PL 역할) 경험자• 리소스·일정·품질을 균형 있게 조율할 수 있는 실행력과 커뮤니케이션 역량을 갖춘 분• 개발 기술 및 기술 트렌드에 대한 이해도가 높으신 분• Hardware 및 Firmware 개발 이해도가 있는 분• Product Lifecycle 및 PLM 프로세스 전반에 대한 이해도가 높으신 분• 기술 문서 작성 및 관리 능력이 있으신 분• 해외 출장 및 근무에 결격 사유 없으신 분.","이런 분들을 우대합니다.• 헬스케어, 의료기기 산업 관련 프로젝트 경험자• 스타트업 또는 변화가 빠른 환경에서 실무 경험이 풍부한 분• 조직 성장과 개발 문화 개선에 기여한 경험이 있으신 분• PLM 전주기를 경험해 보신 분."
앤서스랩코리아,"| 우리는 이런 일을 해요Poker Broadcasting 시스템 개발 프로젝트를 기획 및 관리합니다.프로젝트 일정, 예산, 리소스 관리와 함께 진행 상황을 모니터링합니다.개발팀, 디자이너, 방송 중계팀 및 파트너 등 다양한 관련자들과 협업하며 의사소통을 관리합니다.프로젝트 목표 및 요구사항을 정의하고 우선순위를 설정하며 리스크를 관리합니다.Agile/Scrum 등의 방식으로 팀을 운영하고 결과물에 대한 보고서를 작성 및 경영진과 공유합니다.","| 이런 분과 함께 하고 싶어요IT, 소프트웨어 개발, 또는 방송 관련 프로젝트 리드 경험이 5년 이상인 분Agile, Scrum, 또는 Waterfall 등 프로젝트 관리 방법론에 대한 깊은 이해와 실무 경험이 있는 분디자인, 개발, 마케팅 등 다양한 팀과의 협업 및 조율 능력이 뛰어난 분글로벌 이해관계자와의 협업 과정에서 적극적으로 문제를 분석하고 해결책을 제시할 수 있는 분.","| 이런 경험이 있으면 더 좋아요소프트웨어 개발이나 데이터 분석 등 기술적 배경에 대한 기본적인 이해가 높은 분방송 중계 시스템 개발, 데이터 시각화 등 프로젝트 경험이 있는 분포커 또는 Hold'em 게임에 대한 이해나 관심이 있는 분 (특히 유튜브 등에서 포커 중계를 즐겨 보시는 분)문제 해결 능력과 명확한 의사소통 능력을 갖춘 분."
옵트에이아이,"• 고객 및 시장 요구사항 분석: 시장 조사, 고객 니즈 분석, 페인 포인트 발굴 및 제품 기회로 전환• 제품 비전/로드맵 수립: 비즈니스 목표와 기술적 제약 고려하여 제품의 로드맵 설정, 기획 및 전략 수립• 애자일 개발 프로세스 리딩: 개발팀 및 고객사 사업 간 긴밀한 협업을 통한 제품 개발 운영, 마일스톤 관리• 제품 출시 및 GTM 전략 실행: 시장 출시 전략 수립, 기술 문서 제작, 마케팅 콘텐츠 제작.",• B2B SW 솔루션 기획 또는 PM 경력 3년 이상• AI 기술에 대한 높은 이해와 이를 비즈니스 가치로 전환할 수 있는 능력• 데이터와 논리에 기반한 명확한 제품 요구사항 문서(PRD) 작성 및 협업 능력.,"• 스타트업 또는 기술 중심 조직에서의 솔루션 개발 경험• 방산 및 제조 AI, 모빌리티, 반도체 등 산업군 대상 B2B 경험• 정부과제 또는 기술기반 사업화 경험• 전회/컨퍼런스 등 행사 기획 및 참가 경험• 제품 마케팅 및 콘텐츠 기획 경험• B2B 소통 채널 운영 경험 (기술 블로그, 백서, 웨비나, 홈페이지, 링크드인 등)• 원활한 영어 커뮤니케이션 및 해외 출장 가능자."
슈프리마,"• Product Planning and Roadmap (80%)• 특정 제품 기능 및 역량에 대해 기획과 실행을 책임지고 관리합니다.• 기능별 로드맵 및 백로그 관리, 세부 기획, 개발 진행 상황 모니터링 등을 포함합니다.• 시장 보고서, 업계 행사, 산업 동향 등을 통해 시장 정보를 수집하고 정리합니다.• 해외 팀 및 파트너로부터 인사이트를 수집하여 제품 기회를 발굴합니다.• 수집한 정보를 바탕으로 제품 및 마케팅 우선순위에 대한 실행 가능한 제안으로 정리합니다.2. Sales & Partner Enablement (20%)• 고객 및 파트너와의 사전 영업 논의에서 요구사항을 명확히 파악하고 전달합니다.• 웨비나, 교육 세션, 세미나, 1:1 브리핑 등 다양한 형식으로 제품 정보를 전달합니다.1. Product Planning and Roadmap (80%)• Take responsibility for planning and oversight of certain product features and capabilities.• Includes Feature feature roadmap and backlog, detailed planning, and delivery oversight.• Collect and organize market intelligence from reports, events, and industry sources.• Gather insights from overseas teams and partners to identify product opportunities.• Summarize findings into actionable recommendations for product and marketing priorities.2. Sales & Partner Enablement (20%)• Support pre-sales discussions by clarifying customer and partner requirements.• Plan and deliver product information sessions (webinars, training, seminars, 1:1 briefings).","• 영어와 한국어로 자유롭게 의사소통이 가능하신 분 (다국어 가능자는 우대)• 스스로 업무를 정의하고 실행하며, 새로운 아이디어를 제안할 수 있는 분• 시장 조사, 경쟁 분석, 사용자 피드백 등을 수집하고 정리하여 인사이트를 도출할 수 있는 분• 제품 기획 경험이 있으며, PRD 작성, 유저 스토리 설계, 로드맵 우선순위 정리, 지표 추적 등의 업무를 수행해보신 분• 문서 작성, 일정 계획, 부서 간 협업 등 꼼꼼함이 요구되는 업무에 강점을 가지신 분• 보안, 네트워크 장비, 또는 B2B SaaS 분야에 대한 배경 지식이나 경험이 있으신 분 우대• 전략적 사고와 일상 실행력을 균형 있게 갖추신 분• 학력 : 학사 이상• 경력 : 3년 이상 (경력과 역량에 따라 직급 및 처우 협의 가능)• Strong communication skills in both English and Korean (additional languages are a plus)• Self-directed and proactive — able to define your own tasks and bring new ideas forward• Able to gather and synthesize market research, competitor analysis, and user feedback• Experience in product management including writing PRDs, user stories, roadmap prioritization, and metric tracking• Detail-oriented with strength in documentation, planning, and cross-functional coordination• Preferred background in security, networking equipment, or B2B SaaS• Able to balance strategic thinking with consistent execution• Education: Bachelor’s degree or higher• Experience: 3+ years (role and compensation will be adjusted based on experience and capability).","• 보안, 네트워크 장비, 또는 B2B SaaS 분야에서의 실무 경험이 있으신 분• 파트너 온보딩, 고객 지원, 제품 교육 등의 경험이 있는 분• 영문 기술 문서 작성 또는 다국어 자료 현지화 경험이 있는 분• Jira, Notion, MS Teams 등 협업 도구 사용에 익숙하신 분• 시장 조사 또는 경쟁사 분석을 기반으로 기획 업무를 수행해본 경험이 있는 분• Hands-on experience in security, networking, or B2B SaaS• Experience supporting partner onboarding, customer support, or product training• Familiarity with creating technical documentation (especially in English) or localizing materials for different markets• Proficiency with collaboration tools like Jira, Notion, and MS Teams• Experience conducting market research or competitor analysis to inform product planning."
퓨처센스(FutureSense),"주요업무(식품)제조업 생산관리 B2B SaaS1. 시스템 기획 및 프로젝트 개발 관리2. 기술 및 시장 동향 분석에 따른 UX|BX|CX 요구사항 수립3. 고객사 컨설팅 및 요구사항 수집, 개발조직 소통기술스택1. 백엔드: Typescript Python Node.js Nest.js PostgreSQL2. 인프라: AWS RDS, EKS, Lambda, Github Actions3. 프론트: React React Native4. 협업툴: Github Jira Slack Notion Confluence.",• 3년이상 생산관리 웹|앱서비스 시스템 기획 및 설계 실무 경험2. 소프트웨어 설계 능력 및 개발 언어&도구 이해3. 데이터 기반 의사결정 능력과 경험4. 뛰어난 커뮤니케이션 및 협업 능력.,• (식품)제조업 생산관리 시스템 관련 프로젝트 수행 경험2. SaaS 프로젝트 참여 경험3. 머신러닝 기반 수요예측 또는 데이터 분석 프로젝트 참여 경험.
세컨드팀,"• Global Tech HR 플랫폼을 구축하고, 신규 서비스를 기획해요• 제품 전략을 수립하고, 고객 문제를 해결해요• 데이터를 기반으로 가설을 실험하고, 핵심지표를 개선해요• 목적 조직의 PM으로서 로드맵 수립, 이슈 관리, 유관부서 협업 등 프로젝트를 매니징 해요.",• PM 경력 3년 이상이신 분• B2B SaaS 플랫폼 기획 1년 이상이신 분• HR 플랫폼 및 HR 비즈니스 생태계에 대한 이해도가 높으신 분• 영어 커뮤니케이션이 가능하신 분 (글로벌 팀과 협업).,"• SQL이 능통하신 분• 제품을 초기부터 기획하고, 성장시킨 경험이 있으신 분• 자기주도적으로 일하시고, 긍정적인 마인드를 보유하신 분• HR & ATS 플랫폼 생태계에 대한 이해도가 높으신 분• Global HR Platform에 대한 관심과 기술적 이해도가 높으신 분• HR 플랫폼을 고객으로서 많이 사용해 보신 분• B2C/B2B 앱 서비스, 플랫폼 환경에 관심이 많으신 분."
페이히어,"[신입 프로덕트 매니저]는 이런 일을 해요• 제품 운영 프로세스를 관리하고, 개선점을 발견합니다.• 사용자 피드백을 수집·분석해 문제를 정의하고 개선안을 제안합니다.• 기능 개선 요청 정리, 정책 문서 작성 등 스쿼드의 운영 프로세스를 주도적으로 관리합니다.• 사용자 데이터 리서치 및 간단한 분석을 통해 인사이트를 도출합니다.• 제품의 운영부터 개선, 기획까지 전 과정을 직접 경험합니다.","[이런 경험이 있으신 분을 찾고 있어요]• IT 서비스를 기획·운영해본 경험이 있는 분을 찾습니다.• 문제를 논리적으로 분석하고 실행을 통해 개선해본 경험이 있는 분을 찾습니다.• 빠르게 배우고, 피드백을 반영해 결과를 만들어내는 분을 찾습니다.• 다양한 직군과 협업하며, 명확하고 유연하게 소통할 수 있는 분을 찾습니다.• 실제 서비스의 운영과 성장에 깊은 관심이 있는 분을 찾습니다.","[이런 경험이 있으시면 더 좋아요]• 스타트업, IT 서비스, 핀테크 관련 프로젝트 또는 인턴 경험이 있는 분이면 더욱 좋습니다.• Slack, Notion, Figma, Jira, Google Workspace 등 협업 툴 활용 경험이 있는 분이면 더욱 좋습니다.• 결제, POS, SaaS 관련 서비스에 대한 관심 또는 경험이 있는 분이면 더욱 좋습니다.• 사용자 데이터 분석, SQL 등 기초적인 데이터 처리 경험이 있는 분이면 더욱 좋습니다."
팀플러스,"• 제품 비전 및 전략 수립 - 제품/서비스의 장기적인 비전과 목표를 설정, 이를 달성하기 위한 구체적인 전략 수립• 프로덕트 백로그 관리 및 우선순위 결정: - 제품의 가치를 극대화하기 위해 프로덕트 백로그 아이템(Epic, User Story 등) 정의 - 정기적으로 우선순위를 조정하여 개발 로드맵 수립 및 관리 • 개발부서 협업 - 개발부서와 긴밀히 소통하며 요구사항을 명확히 전달 - 스프린트 계획 수립, 백로그 정제(Refinement), 스프린트 리뷰 등 애자일 프로세스를 주도 • 이해관계자 커뮤니케이션 - 비즈니스, 마케팅, 디자인, QA 등 다양한 이해관계자들과 효과적으로 소통 - 진행 상황을 공유하고 피드백을 수렴하여 반영• 성과 지표 정의 및 분석 - 프로그램 핵심 지표(KPI, OKR 등)를 정의, 데이터를 기반으로 성과 분석하여 지속적인 개선 방안을 모색• 고객 및 시장 분석 사용자 인터뷰, 데이터 분석 등을 통해 고객의 니즈를 깊이 이해• 시장 트렌드를 분석하여 제품 개선 및 신규 기능 기회를 발굴.","• 제품 비전 및 전략 수립 - 제품/서비스의 장기적인 비전과 목표를 설정, 이를 달성하기 위한 구체적인 전략 수립• 프로덕트 백로그 관리 및 우선순위 결정: - 제품의 가치를 극대화하기 위해 프로덕트 백로그 아이템(Epic, User Story 등) 정의 - 정기적으로 우선순위를 조정하여 개발 로드맵 수립 및 관리 • 개발부서 협업 - 개발부서와 긴밀히 소통하며 요구사항을 명확히 전달 - 스프린트 계획 수립, 백로그 정제(Refinement), 스프린트 리뷰 등 애자일 프로세스를 주도 • 이해관계자 커뮤니케이션 - 비즈니스, 마케팅, 디자인, QA 등 다양한 이해관계자들과 효과적으로 소통 - 진행 상황을 공유하고 피드백을 수렴하여 반영• 성과 지표 정의 및 분석 - 프로그램 핵심 지표(KPI, OKR 등)를 정의, 데이터를 기반으로 성과 분석하여 지속적인 개선 방안을 모색• 고객 및 시장 분석 사용자 인터뷰, 데이터 분석 등을 통해 고객의 니즈를 깊이 이해• 시장 트렌드를 분석하여 제품 개선 및 신규 기능 기회를 발굴.","• 신규 서비스 런칭부터 운영 고도화까지 프로덕트 라이프사이클 전반에 대한 경험 보유• Product-Market Fit(PMF)을 찾거나, 비즈니스 성과를 창출한 경험 보유• SAAS, 이커머스, 마케팅, 핀테크 등 특정 산업 도메인에 대한 이해 보유• 데이터베이스, 백엔드/프론트엔드 개발 프로세스에 대한 이해도가 높은 분• Jira, Confluence, Figma 등 협업 툴 활용 능력."
비하베스트,"Product and Project Leadership• Own the end-to-end delivery lifecycle across smart contracts, backend, frontend, and UX.• Lead sprint planning, standups, retrospectives, and release management to ensure timely, high-quality execution.• Build and maintain clear roadmaps, user stories, and detailed specifications that align engineering and business priorities.• Define success metrics and drive accountability across teams.• Collaborate closely with engineering, design, and operations to refine features, mitigate risks, and remove development bottlenecks.External Communication and DevRel• Manage technical communications and documentation for external developers and partners.• Craft and coordinate English-language product and partnership communications with technical precision and clarity.• Serve as a bridge between internal teams and the broader ecosystem, ensuring our products are clearly understood and adopted.","• 5+ years of product management experience, with a strong record of shipping infrastructure or technical products end to end.• Deep understanding of Web3 ecosystems (wallets, Layer 1 or Layer 2 protocols, developer tools, or trading platforms) or proven excellence in complex SaaS product domains.• Solid understanding on traditional finance investment asset classes and DeFi functionalities, with the ability to connect concepts across both domains.• A true owner mindset: proactive, accountable, and adaptable in fast-paced environments.• Working knowledge (or fast learner) of blockchain fundamentals including transactions, gas, perpetuals, and exchange mechanics.• Comfortable driving collaboration across engineers, designers, and business stakeholders while maintaining momentum.• Exceptional written and verbal communication skills in English, with strong organizational and interpersonal fluency.","• In-depth familiarity with DeFi protocols, tokenomics, and governance frameworks.• Awareness of major players, trends, and innovations shaping Web3.• Experience with LLM-powered tooling or productivity systems.• Prior experience as a founder or early-stage team member taking a product from 0 to 1."
팜킷,"• 개발 프로젝트 마일스톤 / 일정 관리 • 개발 프로젝트 요구사항 관리• 비개발 부서 / 고객과 소통• 비개발 부서 / 고객의 메시지를 개발부서에서 이해할 수 있는 요구사항 형태로 추출• 개발부서의 메시지를 비개발 부서 / 고객이 이해할 수 있는 언어로 전달• 기타 정부 R&D 프로젝트, 개발 관련 문서화.","• 풀스택 개발 경험 3년 이상• 요구사항서 작성 경험• 백엔드, 프론트엔드, 앱, DB 등 전반적인 기술스택에 대한 지식 • 한글, 파워포인트 등 활용, 기술 내용 관련 문서화.",• 정부 R&D과제 기획 및 제안서 작성 업무 경험 보유• 인공지능 관련 전반적인 지식.
